{
  "$schema": "https://json-schema.org/draft/2020-12/schema",
  "title": "Q-Forge Reporter Findings",
  "type": "object",
  "required": ["title", "sections", "findings"],
  "properties": {
    "title": { "type": "string" },
    "summary": { "type": "string" },
    "metadata": {
      "type": "object",
      "additionalProperties": {
        "type": ["string", "number", "boolean"]
      }
    },
    "sections": {
      "type": "array",
      "items": {
        "type": "object",
        "required": ["title"],
        "properties": {
          "title": { "type": "string" },
          "body": { "type": "string" },
          "bullets": {
            "type": "array",
            "items": { "type": "string" }
          },
          "table": {
            "type": "object",
            "required": ["headers", "rows"],
            "properties": {
              "headers": {
                "type": "array",
                "items": { "type": "string" }
              },
              "rows": {
                "type": "array",
                "items": {
                  "type": "array",
                  "items": { "type": ["string", "number", "boolean"] }
                }
              }
            }
          }
        }
      }
    },
    "findings": {
      "type": "array",
      "items": {
        "type": "object",
        "required": ["title", "detail"],
        "properties": {
          "id": { "type": "string" },
          "severity": {
            "type": "string",
            "enum": ["info", "warning", "warn", "critical"]
          },
          "title": { "type": "string" },
          "detail": { "type": "string" }
        }
      }
    }
  }
}
